,id_num,title,length,genres,directors,writers,stars,plot,keywords,rating,num_rating
359,tt0478311,Knocked Up (2007) - IMDb,2h 9min,Comedy Romance,Judd_Apatow,Judd_Apatow,Seth_Rogen Katherine_Heigl Paul_Rudd,"For fun-loving party animal Ben Stone, the last thing he ever expected was for his one-night stand to show up on his doorstep eight weeks later to tell him she's pregnant with his child. When Alison Scott is promoted in E! Television, she goes to a night-club to celebrate with her older married sister Debbie. Alison meets the pothead reckless Ben Stone and while having a small talk with Ben, Debbie's husband Pete calls her to tell that their daughter has chicken pox. Debbie leaves the place but Allison stays with Ben, drinking and dancing along all night; completely wasted, they end up having a one night stand. Ben does not use condom and eight weeks later, Allison discovers that she is pregnant. She calls Ben and they decide to try to stay together and have the baby. However, Ben needs to grow-up first to raise a family of his own. Ben Stone, like his four roommates, is a schlub and slacker. Their sole work - unpaid self-employment - is creating a website that identifies where scenes of women's nudity appears in mainstream movies. Alison Scott lives in a suite in the house of Debbie and Pete, her sister and brother-in-law. Slightly insecure Alison masks that insecurity by trying to control her life, much like her sister. Alison celebrates her promotion as on-air reporter for E! by going out with Debbie to a club, where she meets Ben. A generous gesture on Ben's part leads to Ben and Alison hooking up, which by the sober light of day she realizes was probably a mistake as they are totally incompatible. Conversely, Ben really likes Alison, who generally would be considered out of his league. However, that liaison results in Alison becoming pregnant. After thinking about the implications, she decides to keep the baby. Beyond the personal issues, Alison struggles with how this pregnancy will affect her new job, especially in the eyes of her image conscious bosses, Jack and Jill. Despite being a big kid himself, Ben, wanting to do right by Alison, supports her in any way he can. As they are both ""nice"" people who strive for the traditional when it comes to family, they decide to give their relationship a shot despite their incompatibility. Especially for Alison, her primary concern is not ending up the way of Debbie and Pete, who too are incompatible, who only married because Debbie got pregnant, and who both seem unhappy in their married life. For fun-loving party animal Ben Stone, the last thing he ever expected was for his one-night stand to show up on his doorstep eight weeks later to tell him she's pregnant with his child.",unplanned_pregnancy one_night_stand pregnancy website slacker pregnant_woman_in_bathtub f_word argument party club roommate dancing condom porn_actor_in_mainstream_movie holding_someone's_breasts reference_to_pubic_hair vomiting jew female_explicit_nudity birth_crowning vagina stripper giggle missionary_position strip_club talking_during_sex gross_out_humor cameo profanity vulgarity machismo man_in_a_wheelchair hand_on_breast ultrasound_imaging playing_ping_pong man_wearing_a_towel female_sitting_on_a_toilet trouble_using_a_condom jumping_into_a_pool blowing_smoke_ring laughing_child awakened_by_a_child woman_in_bathtub sex_in_bed girl_in_panties thong_panties black_panties white_panties panties lust public_nudity female_frontal_nudity breasts scantily_clad_female cleavage reference_to_stephen_hawking stoner actor_playing_himself reference_to_google bare_chested_male unprotected_sex weed pot_smoking grass ganja cannabis reference_to_pepsi sex_with_pregnant_woman reference_to_costco sex_comedy real_life_mother_and_daughter_playing_mother_and_daughter friend drunkenness drug_use dating bed world_wide_web woman_on_top television_show television_network television_executive shopping sex_talk playhouse pink_eye penis_joke obstetrician natural_childbirth messy_apartment male_rear_nudity internet husband_wife_relationship gynecology gynecological_exam fart_joke dinner close_up bubble_bath birth birthday_cake belly bathtub bare_butt bar_mitzvah apartment masturbation rear_entry_sex roller_coaster pornography paintball machete lesbian_kiss hit_in_the_crotch hallucination gas_mask canadian_stereotype father_daughter_relationship bar multiple_cameos female_nudity catch_phrase drunken_sex hallucinogenic_drug bouncer unemployment trampoline television_producer sister_sister_relationship mother_daughter_relationship marriage marriage_proposal male_nudity magic_mushroom lap_dance job_promotion jealousy interview infidelity hotel gynecologist gay_slur fantasy_baseball earthquake drug_humor doorman diner cirque_du_soleil childbirth canadian_expatriate breakup bookstore ping_pong crib birthday_party beard sex_scene love los_angeles_california las_vegas_nevada unwed_pregnancy restaurant nightclub hospital father_son_relationship marijuana premarital_sex casual_sex actor_shares_first_name_with_character,7.0,"301,591"
360,tt1490726,Kandahar Break: Fortress of War (2009) - IMDb,1h 34min,Drama Romance Thriller,David_Whitney,David_Whitney,Shaun_Dooley Dean_Andrews Rasheed_Naz,"In 1999, a British mine clearance engineer working for the Taliban government in Afghanistan must flee the country when he becomes embroiled in a deadly game of intrigue and betrayal. In 1999, a British mine clearance engineer working for the Taliban government in Afghanistan must flee the country when he becomes embroiled in a deadly game of intrigue and betrayal.",taliban afghanistan place_name_in_title love escape,5.4,222
361,tt1485096,The Prodigy (2009) - IMDb,1h 17min,Animation,Robert_D._Hanna,Robert_D._Hanna,Robby_Daniels Ray_Hanna Jeffrey_Lee_Hollis,"An animated action comedy that follows the quest of a young panda girl named KG, the Kung-Fu Girl. With the help of her brave yet zany Master Panda, KG must rescue the handsome Prince Po ...
                    See full summary » An animated action comedy that follows the quest of a young panda girl named KG, the Kung-Fu Girl. With the help of her brave yet zany Master Panda, KG must rescue the handsome Prince Po and restore justice to her beautiful kingdom. During her adventure, KG learns that there is no limit to what she can accomplish, if she believes in herself.",panda kung_fu teenager surrealism martial_arts,2.2,176
362,tt5946852,Janatha Garage (2016) - IMDb,2h 42min,Action Romance,Koratala_Siva,Koratala_Siva,Junior_N.T.R. Mohanlal Samantha_Ruth_Prabhu,A student who loves the nature unites with the Mechanic who loves to help the people. Both of them should face the Most deadly business man to save his people of Garage. A student who loves the nature unites with the Mechanic who loves to help the people. Both of them should face the Most deadly business man to save his people of Garage.,,8.1,"2,092"
363,tt1993396,Toxin (2015) - IMDb,1h 17min,Drama Horror Sci-Fi,Jason_Dudek,Jason_Dudek,Taylor_Handley Danny_Glover Vinnie_Jones,A pharmaceutical company recruits a well-known scientist to help develop a vaccine against a deadly virus. A pharmaceutical company recruits a well-known scientist to help develop a vaccine against a deadly virus.,,2.9,782
364,tt0171363,The Haunting (1999) - IMDb,1h 53min,Fantasy Horror Mystery,Jan_de_Bont,David_Self Shirley_Jackson,Liam_Neeson Catherine_Zeta-Jones Owen_Wilson,"When Eleanor, Theo, and Luke decide to take part in a sleep study at a huge mansion they get more than they bargained for when Dr. Marrow tells them of the house's ghostly past. A remake of the classic 1963 movie ""The Haunting"" about a team of paranormal experts who look into strange occurrences in an ill-fated house. Through the course of the night some will unravel, some will question, and all will fight for their lives as the house fights back. Eleanor Lance is called to meet at Hill House for Dr. Marrow's sleeping disorder studies, along with three other people. The owners of the house tell them that no one will be around and that they won't be able to hear them. The first night they all sit around and talk. Eleanor tells them that her sleeping disorder is different because she can sleep; it is just that she wakes up because she thinks her dead mom is still living with her. Well that isn't the case now because she is woken one night in the Hill House bedroom by talking children's voices asking her for her help. At first scared by the voice, she learns to avoid them. Later, the group finds out that Dr. Marrow is not using them for sleeping disorders but a test in fear. The fear is first thought to be fake but eventually turns real when loud noises are heard and objects start to move. Now they must try and escape the house before they are all killed. Three people get paid to spend the night in a haunted mansion. They think that they are there for a insomnia experiment but are really there for an experiment in fear. Once there they all are haunted by the ghosts of the children and the man and woman who were killed in the mansion. In ""The Haunting,"" a group of insomniac volunteer research subjects travel to a massive old mansion to undergo testing for what they believe to be insomnia studies. What they do not know is that the professor in charge is actually conducting experiments on human fear. As the days and nights pass, the group slowly begins to learn the terrifying secret behind the house's former owner. They soon realize that the house is pure evil, and they must battle a terrifying spirit to escape the house of nightmares. When Eleanor, Theo, and Luke decide to take part in a sleep study at a huge mansion they get more than they bargained for when Dr. Marrow tells them of the house's ghostly past.",haunted_house mansion horror_movie_remake old_house greenhouse fear experiment insomnia haunting children evil insomniac spirit ghost remake research rural_setting talking_to_a_ghost passing_through_a_person object_floats_in_the_air bedsheet sheet curtains orchestral_music_score walk_in_fireplace female_protagonist trauma perception face_slap shock hysteria fugue photo_album logbook poster strange_noise audio_recording pianist money caretaker map researcher death paranormal_activity reference_to_jacqueline_susann reference_to_auguste_rodin newspaper_ad sister_sister_relationship influenza lesbianism stupid_victim reference_to_martha_stewart barefoot suicide story_telling skeleton seduction sculpture psychologist poltergeist piano_wire loner lesbian knife hair_brush garden fountain delusion confrontation child_labor cherub blood ashes apparition accusation painting sacrifice hall_of_mirrors secret_door statue overnight_in_a_haunted_house hanging doctor spiral_staircase decapitation ancestor spook psychological_experiment bisexual supernatural_power castle chimney severed_head child_murder psychology fireplace wind bone carvings based_on_novel surprise_ending,4.9,"59,563"
365,tt4086722,The Afterglow (2014) - IMDb,1h 38min,Drama Horror Thriller,Yolanda_Torres Joan_Álvarez,Joan_Álvarez,Paul_Coster Claudia_Trujillo Sarah_Tyler_Shaw,"THE AFTERGLOW weaves a tale of obsession, its denial and eventual acceptance, where the ghosts of the past refuse to be ignored any longer. Oliver Price is a successful writer whose ...
                    See full summary » THE AFTERGLOW weaves a tale of obsession, its denial and eventual acceptance, where the ghosts of the past refuse to be ignored any longer. Oliver Price is a successful writer whose personal life was marked by a sinister childhood encounter: his sexual awakening at the hands of a dead girl. Since then, Oliver has stubbornly clung to an obsession with finding a dark, almost supernatural relationship. One day Oliver believes he has found what he is seeking in his dead brother's girlfriend, an enigmatic girl who seeks refuge by his side as she tries to recover her memories, destroyed in an apparent suicide attempt. The relationship between Oliver and Laura darkens with obsession and by a strange nature which threatens to destroy them both. Oliver is a writer whose personal life was marked by a sinister childhood encounter: his sexual awakening at the hands of a dead girl. When Oliver's path crosses Laura's, an enigmatic girl seeking refuge as she tries to recover her memories, destroyed in an apparent suicide attempt, dark secrets threaten to destroy them both.",,8.0,7
366,tt0005939,The Quest (1915) - IMDb,,Action Adventure Drama,Harry_A._Pollard,F._McGrew_Willis F._McGrew_Willis,Harry_A._Pollard Lucille_Ward Joseph_Singleton,"John Douglas, a high-society playboy, is a cynic concerning the women of his social set, and has a pictured ideal of the girl of his dreams. Wising to avoid the upcoming social season, he ...
                    See full summary » John Douglas, a high-society playboy, is a cynic concerning the women of his social set, and has a pictured ideal of the girl of his dreams. Wising to avoid the upcoming social season, he hops a freighter bound for the Orient. It sinks in mid-ocean and he, as the sole survivor, is washed upon a island, where he is rescued by Nia, daughter of the tribal chief, Neto.John is puzzled as all of the tribe are white people, but he learns from the tribal chief they are descendent's of English-origin who also are on the island because of a ship wreck a few hundred years ago. John soon arouses the jealousy of Kaura, the tribal sub-chief who wants Nia as his bride, but Nia wants nothing to do with Nia, and favors John. Kaura demand that Nia become his bride, but John Rescues her and they head for the jungle, with Kaura and his henchmen in hot pursuit. The pursuit only lasts until a storm comes up and Kuara is killed by a bolt of lightning, and his followers take that as a sign the Gods aren't in favor of the pursuit. John and Nia take up residence in the Tribal Priest's jungle cave, after the Tribal Chief performs a marriage ceremony. They are quite happy and content, especially Nia who likes to play the harp John made for her. But a yacht appears on the horizon, and John struggles with a decision as to light a signal fire and be taken back to civilization.",tribal_chief jungle island yacht storm signal_fire rescue playboy orient marriage_ceremony lightning jealousy high_society harp freighter dream cave ship_wreck romantic_rivalry unconsciousness husband_wife_relationship father_daughter_relationship tuxedo struck_by_lightning society_woman search san_francisco_california ruler quest party pacific_ocean musician lost_tribe legend hut hit_with_a_rock fistfight death costume cigarette_smoking boredom bachelor anger ancestry 1910s castaway,5.0,7
367,tt1016184,Hit for Six (2007) - IMDb,1h 39min,Drama Sport,Alison_Saunders-Franklyn,Alison_Saunders-Franklyn,Andrew_Pilgrim Rudolph_Walker Jeanille_Bonterre,"A sidelined West Indies cricketer fights demons of his past, including a match fixing charge, and learns about love in an unlikely quest to play in a major global tournament and earn the ...
                    See full summary » A sidelined West Indies cricketer fights demons of his past, including a match fixing charge, and learns about love in an unlikely quest to play in a major global tournament and earn the respect of his estranged father, a former great West Indies player.",west_indian cricket_the_game number_in_title,6.1,13
368,tt0116772,The Killing Jar (1997) - IMDb,1h 41min,Drama Horror Mystery,Evan_Crooke,Mark_Mullin,Brett_Cullen Tamlyn_Tomita Wes_Studi,"Michael Sanford and his wife move to his old town so he can take over the family business. However, gruesome murders of children start to happen. Meanwhile, Michael starts to become slowly ...
                    See full summary » Michael Sanford and his wife move to his old town so he can take over the family business. However, gruesome murders of children start to happen. Meanwhile, Michael starts to become slowly insane, after he may have witnessed one of the murders and reports it to the police. Is he the murderer, or is it something of his past?",murder independent_film,4.5,196
369,tt0036855,Gaslight (1944) - IMDb,1h 54min,Crime Drama Film-Noir,George_Cukor,John_Van_Druten Walter_Reisch,Charles_Boyer Ingrid_Bergman Joseph_Cotten,"Years after her aunt was murdered in her home, a young woman moves back into the house with her new husband. However, he has a secret that he will do anything to protect, even if it means driving his wife insane. Paula's aunt, Alice Alquist, a famous entertainer, is murdered in her home. Paula, who lives with her aunt, finds the body. Police fail to find the killer, and Paula is sent away to school. Ten years later, Paula returns to London with her new husband. They take up residence in her aunt's house, which she has inherited. Paula is increasingly isolated by her husband but does come to the attention of an admirer of her aunt, Mr. Brian Cameron. In London, at 9 Thorton Square, the prima donna Alice Alquist is strangled, and her famous jewels disappear. Her young niece Paula is sent to Italy to study music, and the house stays empty. Ten years later, Paula decides to get married with an older pianist named Gregory Anton, who convinces her to move back to the old address in London. When they arrive, Paula finds a letter from a mysterious and unknown Sergis Bauer, which makes Gregory upset. He psychologically begins to torture Paula, and she has a nervous breakdown and also has insecurity and memory problems. When the Scotland Yard policeman Brian Cameron sees Gregory and Alice in a place popular with tourists, he immediately he sees Paula, who reminds him of her aunt, but he does not know Gregory, and decides to investigate and find evidence to connect Gregory with the unsolved murder, while Paula is being driven insane and menaced by her husband. Years after her aunt was murdered in her home, a young woman moves back into the house with her new husband. However, he has a secret that he will do anything to protect, even if it means driving his wife insane.",nervous_breakdown fear_of_one's_husband husband_wife_relationship scotland_yard pianist letter italy murder jewel haunting strangulation sapphire ruby diamond hitchcockian pole_the_structure tied_to_a_chair male_tied_up gaslight female_protagonist driving_someone_mad one_word_title orchestral_music_score newspaper_headline paranoia tower_of_london sheet_music psychological_torment proposal police_detective obsession neighbor music_teacher marriage lake_como gem fog cook concert train tied_up piano loss_of_aunt dead_aunt 1800s driven_mad 19th_century woman_in_jeopardy psycho_thriller mansion maid loot victorian_era london_england insanity based_on_play,7.9,"17,072"
370,tt2008457,Assolo (2014) - IMDb,1h 20min,Comedy Drama Music,Massimo_Piccolo,Massimo_Piccolo Massimo_Piccolo,Michele_Busiello Adriana_Cardinale Gianfranco_Cercola,"Danny 'Sweet Touch' Caputo is a young sax player on the verge of crowning is life's dream, to play in the festival that will send him to the top, amongst the jazz greats. Whit just 50 ...
                    See full summary » Danny 'Sweet Touch' Caputo is a young sax player on the verge of crowning is life's dream, to play in the festival that will send him to the top, amongst the jazz greats. Whit just 50 minutes standing between him and his consecration, as he runs over his last simple question more to pass time than anything else. Danny tries to answer, but instead finds himself projected into another world, one populated by the sensual and very real ghosts of his past...",jazz,5.4,18
371,tt0325710,The Last Samurai (2003) - IMDb,2h 34min,Action Drama History,Edward_Zwick,John_Logan John_Logan,Tom_Cruise Ken_Watanabe Billy_Connolly,"An American military advisor embraces the Samurai culture he was hired to destroy after he is captured in battle. In the 1870s, Captain Nathan Algren, a cynical veteran of the American Civil war who will work for anyone, is hired by Americans who want lucrative contracts with the Emperor of Japan to train the peasant conscripts for the first standing imperial army in modern warfare using firearms. The imperial Omura cabinet's first priority is to repress a rebellion of traditionalist Samurai -hereditary warriors- who remain devoted to the sacred dynasty but reject the Westernizing policy and even refuse firearms. Yet when his ill-prepared superior force sets out too soon, their panic allows the sword-wielding samurai to crush them. Badly wounded Algren's courageous stand makes the samurai leader Katsumoto spare his life; once nursed to health he learns to know and respect the old Japanese way, and participates as advisor in Katsumoto's failed attempt to save the Bushido tradition, but Omura gets repressive laws enacted- he must now choose to honor his loyalty to one of the embittered sides when the conflict returns to the battlefield... In Japan, Civil War veteran Captain Nathan Algren trains the Emperor's troops to use modern weapons as they prepare to defeat the last of the country's samurais. But Algren's passion is swayed when he is captured by the samurai and learns about their traditions and code of honor. Set in Japan during the 1870s, The Last Samurai tells the story of Capt. Nathan Algren (Tom Cruise), a respected American military officer hired by the Emperor of Japan to train the country's first army in the art of modern warfare. As the Emperor attempts to eradicate the ancient Imperial Samurai warriors in preparation for more Westernized and trade-friendly government policies, Algren finds himself unexpectedly impressed and influenced by his encounters with the Samurai, which places him at the center of a struggle between two eras and two worlds, with only his own sense of honor to guide him. An American military advisor embraces the Samurai culture he was hired to destroy after he is captured in battle.",samurai emperor japan honor captain 1870s code_of_honor american_civil_war rebellion civil_war warrior battlefield samurai_warrior japanese defeat battle kiss box_office_hit u.s._civil_war seppuku no_opening_credits slow_motion_scene war_hero horse street_fight sabre irish_american hand_to_hand_combat combat last_stand cavalry_charge lance spear unreliable_narrator troubled_mind imagination legend tragic_hero tragic_past dark_hero secret_past troubled_youth ambiguous_ending ambiguity yamashiro_province_japan reference_to_battle_of_thermopylae greek persian howitzer hair_knot railroad stitches pacific_ocean bet meditation military_discipline destruction linguist vengeance hatred council savage wisdom living_god reference_to_god centennial winchester_rifle tiger fired_from_the_job restaurant sideshow reference_to_george_armstrong_custer foolheartiness arrogance bath fire prayer brother_in_law journal compassion tears crying flash_forward retreat bravery military_officer torture attack fight general mask stabbing knife fear u.s._president scalp theatre_production u.s._army friend regiment rebel beheading cherry_blossom cannon soldier boy woods u.s._cavalry slaughter drunkenness drinking drink tribal_leader tribe duty apology brother_sister_relationship father_son_relationship spirituality japanese_emperor medal_of_honor scalping armor karma calligraphy bowing coolie rickshaw irony year_1877 year_1876 drugged_drink stabbed_in_the_shoulder politics husband_wife_relationship held_captive beating forest shootout ex_soldier thrown_from_a_horse surrender japanese_flag spitting_blood bowl shot_in_the_throat stabbed_in_the_throat throwing_a_spear friendly_fire blood_on_camera_lens binoculars bayonet voice_over_narration traitor shot_through_a_door hand_cut_off knife_in_back execution self_sacrifice cutting_hair tragic_event kicked_in_the_face falling_off_a_roof stabbed_to_death u.s._japanese_relations military_staff mother_son_relationship stabbed_in_the_stomach subtitled_scene hiding_in_a_tree head_cut_off japanese_empire arrow_in_chest military_training sword_throwing threatened_with_a_knife antique_gun rain character_repeating_someone_else's_dialogue held_at_gunpoint chopsticks snow shot_in_the_head inter_cultural camera delegation sake buddhist temple captive genocide translator palace yokohama_japan sea_voyage monk neck_breaking blood_splatter violence flashback english_subtitles_in_original village bokken sheath dojo gore barefoot shot_through_the_chest warlord minister 19th_century warrior_race heritage social_commentary patriot idealism hope tokyo_japan person_on_fire martial_arts friendship massacre suicidal_tendency samurai_sword japanese_culture japanese_army hara_kiri blockbuster winter sword spring_the_season shame sergeant rifle prisoner machine_gun lieutenant_colonel katana gun foreigner dishonor death_of_loved_one death_of_brother dead_husband colonel bow_and_arrow decapitation native_american throat_slitting suicide stabbed_in_the_side stabbed_in_the_neck stabbed_in_the_leg stabbed_in_the_chest stabbed_in_the_back stabbed_in_the_arm shotgun shot_to_death shot_in_the_shoulder shot_in_the_neck shot_in_the_leg shot_in_the_forehead shot_in_the_eye shot_in_the_back shot_in_the_arm severed_head severed_hand sacrifice revenge remorse redemption premonition pistol ninja nightmare murder mass_murder love loss_of_husband loss_of_father loss_of_brother knife_throwing epic death courage child_murder blood assassin alcoholic sword_fight san_francisco_california reverse_footage katana_sword gatling_gun destiny jidai_geki 1800s death_of_son death_of_father prostitute,7.7,"321,458"
