,id_num,title,length,genres,directors,writers,stars,plot,keywords,rating,num_rating
229,tt2140479,The Accountant (2016) - IMDb,2h 8min,Action Crime Drama,Gavin_O'Connor,Bill_Dubuque,Ben_Affleck Anna_Kendrick J.K._Simmons,"As a math savant uncooks the books for a new client, the Treasury Department closes in on his activities and the body count starts to rise. Christian Wolff is a math savante with more affinity for numbers than people. Behind the cover of a small-town CPA office, he works as a freelance accountant for some of the world's most dangerous criminal organizations. With the Treasury Department's Crime Enforcement Division, run by Ray King, starting to close in, Christian takes on a legitimate client: a state-of-the-art robotics company where an accounting clerk has discovered a discrepancy involving millions of dollars. But as Christian uncooks the books and gets closer to the truth, it is the body count that starts to rise. As a math savant uncooks the books for a new client, the Treasury Department closes in on his activities and the body count starts to rise.",numbers accountant middle_finger raised_middle_finger pc computer money sniper nitrile_gloves autism autistic_child profanity gunshot bullet swearing blood punching_a_hole_in_a_wall gun brother hole_in_a_wall hole_in_the_wall hole_in_wall autistic_son breaking_a_knick_knack fistfight mixed_martial_arts martial_arts gunfight shootout assassin two_word_title,7.8,"14,319"
230,tt0241291,House of Perdition (1956) - IMDb,1h 29min,Crime Drama Music,Ramón_Pereda,José_G._Cruz Ramón_Pereda,María_Antonieta_Pons Fernando_Fernández Julio_Villarreal,Add a Plot »,revenge murder melodrama dance_number cabaret,6.4,5
231,tt0475723,Shinobi: Heart Under Blade (2005) - IMDb,1h 47min,Action Drama Fantasy,Ten_Shimoyama,Kenya_Hirata Fûtarô_Yamada,Yukie_Nakama Joe_Odagiri Tomoka_Kurotani,"After more than four hundred years of war between the Shinobi warriors of the Manjidani Koga and Tsubagakure Iga clans, the Lord Hattori Hanzou decrees that they must live in peace. Both ...
                    See full summary » After more than four hundred years of war between the Shinobi warriors of the Manjidani Koga and Tsubagakure Iga clans, the Lord Hattori Hanzou decrees that they must live in peace. Both clans live hidden in the woods and mountain without confrontation and without training ninjas in the shadow art of Shinobi. In 1614, the Lord of the Lords is convinced that the clans are dangerous threats for keeping peace in his lands, and his advisor plots a Machiavellian plan to destroy their best warriors in a contest. Meanwhile, the young Iga Oboro and Koga Gennesuke fall in love for each other. When Oboro's grandmother and leader of Iga clan Ogen and Gennesuke's father and leader of the Koga clan Danjo kill each other, Oboro and Gannesuke must lead their warriors in the ultimate battle of the Shinobi clans. Shinobi centers on the drama resulting from the war between two ninja clans in the early part of the Tokugawa era. In the film, Nakama Yukie portrays Oboro, the granddaughter of Ogen (Lily), the respected Iga clan matriarch, while Odagiri Jo plays Gennosuke, the son of Danjo Koga (Minoru Terada), the powerful Koga clan leader. While living deep within the mountains, the two ninja clans have honed their skills to superhuman levels. Unfortunately, the clans do not get along and are forbidden by imperial decree from sharing their techniques with each other. Viewing the two ninja clans as a threat to his scheme for total domination, the nefarious Nankobo Tenkai (Ishibashi Renji) plots to intensify the rivalry between the two clans. Nakobo creates a contest in which the clans are forced to choose five of their best warriors to participate. The battle, however, isn't just a friendly contest - it's a duel to the death!",ninja love ninjutsu feudal_japan female_ninja one_word_title critically_acclaimed martial_arts japanese violence tragic_love japan 17th_century 1610s based_on_novel,7.0,"10,983"
232,tt0078987,"Companys, procés a Catalunya (1979) - IMDb",2h 5min,Biography Drama History,Josep_Maria_Forn,Josep_Maria_Forn Antoni_Freixas,Luis_Iriondo Marta_Angelat Montserrat_Carulla,"1939: The remains of the Spanish Republican Army crossed the French border. Among the exiles are Lluís Companys, President of the Generalitat de Catalunya, and also Aguirre, President of ...
                    See full summary » 1939: The remains of the Spanish Republican Army crossed the French border. Among the exiles are Lluís Companys, President of the Generalitat de Catalunya, and also Aguirre, President of the Basque Government. After the invasion of France by Nazi troops, Companys will be arrested by the Gestapo and handed over to the Francoist authorities. Led by the Count of Mayalde, he is transferred to Madrid and later to Barcelona. After a summary trial, Companys is condemned to death and shot.",,6.3,43
233,tt0054026,Leute mit Flügeln (1960) - IMDb,2h,War Drama,Konrad_Wolf,Karl-Georg_Egel Karl-Georg_Egel,Erwin_Geschonneck Wilhelm_Koch-Hooge Hilmar_Thate,Add a Plot »,spy,7.8,5
234,tt5480768,Do Me Love (2009) - IMDb,1h 25min,Comedy Drama Romance,Jacky_Katu Lou_Viger,Jacky_Katu Lou_Viger,Lizzie_Brocheré Christine_Armanger Patrick_Zocco,"A married man in his fifties who has lost all interest in his wife suddenly meets Juliette, a young woman. She reignites love in his life but triggers violent arguments with his wife. Their indifference soon turns into chaos. A married man in his fifties who has lost all interest in his wife suddenly meets Juliette, a young woman. She reignites love in his life but triggers violent arguments with his wife. Their indifference soon turns into chaos.",,4.0,5
235,tt0135788,La baie du désir (1964) - IMDb,1h 35min,Crime Drama,Max_Pécas Radley_Metzger,Maurice_Cury Robert_Topart,Fabienne_Dali Sophie_Hardy Jean_Valmont,A young couple become involved with a younger woman and a murder. A young couple become involved with a younger woman and a murder.,murder striptease female_nudity nudity sex,3.9,12
236,tt0346585,'Bayolente' (1999) - IMDb,,Action,Baldo_Marro,Glenn_Marcelo,Zoren_Legaspi Aila_Marie Melissa_Mendez,Add a Plot »,death murder gangster violence pistol shot_to_death blood car_explosion car_crash one_word_title character_name_in_title,3.2,6
237,tt0044706,High Noon (1952) - IMDb,1h 25min,Drama Thriller Western,Fred_Zinnemann,Carl_Foreman John_W._Cunningham,Gary_Cooper Grace_Kelly Thomas_Mitchell,"A marshall, personally compelled to face a returning deadly enemy, finds that his own town refuses to help him. On the day he gets married and hangs up his badge, lawman Will Kane is told that a man he sent to prison years before, Frank Miller, is returning on the noon train to exact his revenge. Having initially decided to leave with his new spouse, Will decides he must go back and face Miller. However, when he seeks the help of the townspeople he has protected for so long, they turn their backs on him. It seems Kane may have to face Miller alone, as well as the rest of Miller's gang, who are waiting for him at the station... In this classic Western, Will Kane, the longtime marshal of Hadleyville in New Mexico territory, has just retired following his marriage with pacifist Quaker Amy Fowler. However, word arrives that Frank Miller, a criminal that Kane once sent away to be hanged, has been pardoned and will arrive into town, at high noon, with one thing on his mind: Revenge on the marshal who once ruined his life. With the threat of vengeful outlaws looming, Kane will have to decide whether he honors his sense of duty or his love for his pacifist bride. Will Kane is a town marshal. It's his wedding day and his last day as a lawman. He was about to leave town with his new bride to start a new life when some men come to town who tell him that a man he sent to prison some years ago has just been released and is arriving on the noon train. Kane and many of the townsfolk who remember him, know that he's coming to town for one thing; to get Will. Will's friends tell him to leave town which he does but Will feeling that running away is not a solution returns and intends to face him. Will tries to find support from his friends but all of them don't want to help him or are too afraid and all that they tell him is to leave, even his wife feels the same way. And as the train comes closer, Will is all alone. A marshall, personally compelled to face a returning deadly enemy, finds that his own town refuses to help him.",one_against_many appeasement street_shootout justice frontier_justice battle fistfight brawl quick_draw morality gunfight shootout real_time marshal lawman revenge outlaw quaker strong_female_lead strong_female_character blonde_woman 19th_century frontier_town desert old_west wild_west one_man_army outlaw_gang beating boyfriend_girlfriend_relationship punched_in_the_face dual_wield colt_.45 u.s._marshal warrior fighting gun_violence gun_battle violence western_town kiss tough_guy western_hero afi mislaid_trust revived_with_water evil_man female_slaps_male sheriff husband_wife_relationship retirement responsibility quitting_a_job one_day old_flame newlywed hostage grudge fight face_slap eye_patch ex_convict deputy courage arson 1880s blockbuster cult_film allegory based_on_magazine_article small_town fire church conscience train new_mexico marriage badge wedding cowboys_and_outlaws cowboy cowboy_boots cowboy_shirt cowboy_hat saddle horse spur barn blonde sheriff's_badge time_for_title stable saloon railway_station judge jail famous_song brother_brother_relationship barbershop clock hero hotel famous_score,8.0,"81,106"
238,tt0099733,Happily Ever After (1990) - IMDb,1h 15min,Family Animation Musical,John_Howley,Martha_Moran Robby_London,Edward_Asner Irene_Cara Carol_Channing,"The Evil Queen is dead and Snow White is on her way to see the 7 dwarves when Lord Maliss, the Queen's brother, sees her in the looking glass. He attacks her in the form of a dragon, taking...
                    See full summary » The Evil Queen is dead and Snow White is on her way to see the 7 dwarves when Lord Maliss, the Queen's brother, sees her in the looking glass. He attacks her in the form of a dragon, taking Snow White's prince to the Realm of Doom. Enlisting the aid of the dwarves' cousins, Snow White must embark on a quest to save her true love. This movie is similar to that of ""Snow White and the Seven Dwarfs."" A young woman Lost in the woods comes across a cottage where 7 dwarfs live. These dwarfs each have a special gift, power of some sort. Mother Nature helps them in their journey to the castle to save the Prince.",prince dragon magical_mirror subjective_camera 2d_animation expression_taken_literally courage fear lightning sister_sister_relationship anger cigar_smoking monster cloak dress cottage mine stupidity collapse exhaustion princess loss_of_sister revenge misfit dwarf defense transformation turned_to_stone party secret_passage bat sorcerer castle beauty bolas owl independent_film title_spoken_by_character,5.0,"1,763"
239,tt0099088,Back to the Future Part III (1990) - IMDb,1h 58min,Action Adventure Comedy,Robert_Zemeckis,Robert_Zemeckis Bob_Gale,Michael_J._Fox Christopher_Lloyd Mary_Steenburgen,"Enjoying a peaceable existence in 1885, Doctor Emmet Brown is about to be killed by Buford ""Mad Dog"" Tannen. Marty McFly travels back in time to save his friend. Stranded in 1955, Marty McFly receives written word from his friend, Doctor Emmett Brown, as to where can be found the DeLorean time machine. However, an unfortunate discovery prompts Marty to go to his friend's aid. Using the time machine, Marty travels to the old west where his friend has run afoul of a gang of thugs and has fallen in love with a local schoolteacher. Using the technology from the time, Marty and Emmett devise one last chance to send the two of them back to the future. This movie picks up where the last one left off--Marty stuck in 1955 after watching the Delorean vanish after being struck by lightning with Doc in it. But moments after, he got a letter from Doc that tells him he was sent to 1885. But the Delorean was damaged and he can't repair it. So he placed it somewhere where he hopes Marty can find it in 1955 and hopefully his younger version can repair it so that Marty can return to 1985. So he goes to the 1955 Doc Brown and tells him about what happened and shows him the letter. So they set out to find the Delorean and do which was hidden near a cemetery. After finding the Delorean, Marty and Doc were about to leave when they find a tombstone with Doc's name on it that says he was killed a few days after he sent the letter and that he was killed by someone named Buford Tannen. Marty and Doc go to the library and learn that Tannen was a crazed gunman and a photo of Doc in 1885. Marty then decides to go back to 1885 to save Doc. Upon arriving, the Delorean gets damaged and the gas tank is leaking. Marty then goes to town to look for Doc. But along the way he meets Tannen and gets on his bad side. Doc saves him and Tannen threatens Doc. Marty then shows Doc the photo of his tombstone. That's when Marty and Doc get ready to leave. But when Marty tells him about the gas tank, Doc tells him, without gas they can't get the Delorean up to 88 miles per hour to activate the time circuits. So they scurry to find a way to get it up to that speed before Doc gets shot. They think they found one which they plan to implement on the day he gets shot. Doc then meets Clara Clayton, the town's new schoolteacher and is smitten with her. That's when he has second thoughts about leaving. When Tannen tries to make a move on Doc, Marty stops him that's when Tannen challenges Marty to a gunfight. Marty initially declines but when Tannen calls him a coward, Marty accepts. Doc and Marty's ancestor tries to convince him he's making a mistake. The conclusion of the trilogy sends Marty McFly on a rescue mission to the year 1885, where he must save Doc Brown from death at the hands of yet another member of the Tannen clan. However, there are a number of complications preventing a quick return to the future: a lack of gasoline for the time-traveling DeLorean, a band of gunslinging outlaws and a schoolmarm with affections for the smitten Doc. Stranded in 1955 after a freak burst of lightning, Marty must travel to 1885 to rescue Doc Brown from a premature end. Surviving an Indian attack and unfriendly townsfolk, Marty finds Doc Brown the blacksmith. But with the Doc under the spell of the charming Clara Clayton, it's up to Marty to get them out of the wild west and back to the future. With the Almanac destroyed by Marty McFly and the time line back on its original course, things are not all well. Dr. Emmett L. Brown and the time machine were somehow struck by lightning, and Marty was somehow received a letter from Doc that he is okay, and in the year 1885. Marty and the 1955 Doc fixed up the time machine after digging it up from a mine, then Marty discovers a grave stone with Doc's name on it, indicating that he will be killed by a man named Beuford Tannen (Biff's ancestor). Marty makes an effort to travel to 1885 to save Doc from his bleak future. But Marty does something to the time machine to not make it run, now Marty and Doc have to figure out to get back to 1985. Unfortunately, this will not be easy with Doc madly in love with a school teacher Clara Clayton, and with Beuford Tannen causing constant trouble for Marty and Doc. Enjoying a peaceable existence in 1885, Doctor Emmet Brown is about to be killed by Buford ""Mad Dog"" Tannen. Marty McFly travels back in time to save his friend.",letter tombstone band dog time_machine cemetery gunfight library blacksmith teacher outlaw saving_a_life box_office_hit steam_engine locomotive transforming_train same_actor_playing_two_characters_simultaneously_on_screen same_actor_playing_two_characters actress_playing_dual_role actor_playing_dual_role time_travel_comedy suburb reading_a_letter_aloud famous_score camera film_camera steampunk_comedy woman_riding_a_horse face_slap buckboard runaway_buckboard spittoon firing_a_gun_into_the_air adult_actor_playing_teenage_boy teenager intergenerational_friendship 17_year_old the_end porch_swing ravine train_bridge steam_locomotive walkie_talkie purple_dress car_on_train_tracks train_whistle stealing_a_train train_hijack climbing_onto_a_moving_train steam_train horseback_train_chase horseback_riding chases_on_horseback punched_in_the_face colt_peacemaker_revolver revolver kicking_gun_out_hand saved_from_hanging emergency_stop peg_on_one's_nose headstone passed_out_drunk year_1955 year_1985 handwritten_letter character_says_i_love_you falling_down_a_hill town_dance white_hair female_slaps_a_male woman_slaps_a_man falling_on_bed_sobbing truth_taken_as_a_lie bullet_dancing roman_numbered_sequel six_word_title roman_numeral_in_title street_shootout 20th_century 19th_century bulletproof_vest top_hat undertaker reference_to_robert_deniro long_johns colt_45 derringer reference_to_jules_verne disgruntled_customer lifting_someone_into_the_air sliding_glass_down_bar child waking_up_in_strange_surroundings bullets_fired_at_feet train_explosion family_relationships dragged_by_a_horse reference_to_clint_eastwood numbered_sequel modern_western shot_back_to_back drunkenness risking_one's_life_for_love girl_next_door hanging part_of_trilogy teenage_boy kiss irish gun farm clock baby alternate_history altering_history animal_in_cast_credits windmill running_out_of_gas breakfast_machine 1980s california blockbuster third_part teenage_hero delorean_dmc_12 train futuristic_train native_american_attack sequel bear mistaken_identity 1950s monument_valley small_town train_wreck computer_cracker street_racing automobile lynching dual_role product_placement chess car_accident manure train_robbery inventor skateboard model_train moonwalk_dancing time_travel photograph flying_train frisbee 1880s drive_in_theatre festival mad_scientist flying_car saloon car_trouble destiny love_at_first_sight marksman irish_american rube_goldberg_machine dancing shooting_gallery cavalry fireplace abandoned_mine,7.4,"289,534"
240,tt4705682,Wewe (2015) - IMDb,1h 40min,Horror,Rizal_Mantovani,,Inong_Nidya_Ayu Nabilah_Ratna_Ayu_Azalia Khadijah_Banderas,"When 5 year old Aruna goes missing, her concerned family starts a search for her and uncovers a secret lying deep within their new home. When 5 year old Aruna goes missing, her concerned family starts a search for her and uncovers a secret lying deep within their new home.",,5.9,8
241,tt1764360,Hicran sokagi (2007) - IMDb,2h 14min,Drama Romance,Safa_Önal,Safa_Önal,Ahu_Türkpençe Ali_Tutal Alp_Derilgen,Add a Plot »,,2.9,72
242,tt3848600,Broken Contract (2015) - IMDb,1h 35min,Action Comedy Crime,James_Pentecost,James_Pentecost James_Pentecost,Esther_Anderson Christopher_Morris Jesse_McGinn,"When Max, a down on his luck strip club owner, has his life and livelihood threatened by local gangsters, he turns to his wife's connections for help and hires a hitman to solve the problem...
                    See full summary » When Max, a down on his luck strip club owner, has his life and livelihood threatened by local gangsters, he turns to his wife's connections for help and hires a hitman to solve the problem once and for all. But before long, Max is blinded by his newfound power and his family finds him spinning off the rails as the body count piles up. When Max, a down on his luck strip club owner, has his life and livelihood threatened by local gangsters, he turns to his wife's connections for help and hires a hitman to solve the problem once and for all. But before long, Max is blinded by his newfound power and his family finds him spinning off the rails as the body count piles up.",,8.4,7
243,tt1481363,Naruto Shippûden: The Movie 3: Inheritors of the Will of Fire (2009) - IMDb,1h 36min,Animation Action Fantasy,Masahiko_Murata,Masashi_Kishimoto Junki_Takegami,Junko_Takeuchi Chie_Nakamura Satoshi_Hino,"Ninjas with bloodline limits begin disappearing in all the countries and blame points toward the fire nation. By Tsunade's order, Kakashi is sacrificed to prevent an all out war. Naruto fights through friends and foes to prevent his death. Four Kekkei Genkai shinobi who have been guarding the Hidden Cloud, Stone, Mist and Sand villages disappear without a trace. The Land of Fire comes under suspicion, as it is the only country to have suffered no losses. Mounting suspicion among the four nations is bringing them to the brink of another Great Ninja War. Ninjas with special bloodline abilities (kekkie Genkie) begin dissapearing from various nations. The mastermind behind these dissapearances originally belonged to the leaf village and thus the village is accused of treachery. The sorrounding nations begin preparing for war. With the world's anger on the leaf village, can Naruto and Kakashi prevent the fourth great ninja war and preserve their will of fire? Ninjas with bloodline limits begin disappearing in all the countries and blame points toward the fire nation. By Tsunade's order, Kakashi is sacrificed to prevent an all out war. Naruto fights through friends and foes to prevent his death.",,7.2,"1,395"
244,tt1329424,Presence (2008) - IMDb,1h 20min,Horror Sci-Fi Thriller,Bryan_Kramer,Bryan_Kramer,Bryant_Cook Tim_Cummings Paula_Mitchell_Manning,"A man races through the city at night, narrating the events that lead to the present apocalypse and trying to escape the disease he believes is the cause of it all. A disease that, in its current mutation, causes heads to explode. A man races through the city at night, narrating the events that lead to the present apocalypse and trying to escape the disease he believes is the cause of it all. A disease that, in its current mutation, causes heads to explode.",low_budget_film pulp independent_film,5.5,15
245,tt0341601,Los supersabios (1978) - IMDb,1h 18min,Animation Comedy Family,Anuar_Badin,Anuar_Badin Germán_Butze,Azucena_Rodríguez Carlos_Riquelme Carlos_Becerril,Add a Plot »,,5.8,15
