,id_num,title,length,genres,directors,writers,stars,plot,keywords,rating,num_rating
114,tt0116209,The English Patient (1996) - IMDb,2h 42min,Drama Romance War,Anthony_Minghella,Michael_Ondaatje Anthony_Minghella,Ralph_Fiennes Juliette_Binoche Willem_Dafoe,"At the close of WWII, a young nurse tends to a badly-burned plane crash victim. His past is shown in flashbacks, revealing an involvement in a fateful love affair. October 1944 in war torn Italy. Hana, a French-Canadian nurse working in a mobile army medical unit, feels like everything she loves in life dies on her. Because of the difficulty traveling and the dangers, especially as the landscape is still heavily booby-trapped with mines, Hana volunteers to stay behind at a church to care solely for a dying semi-amnesiac patient, who is badly burned and disfigured. She agrees to catch up to the rest of the unit after he dies. All the patient remembers is that he is English and that he is married. Their solitude is disrupted with the arrival at the church of fellow Canadian David Caravaggio, part of the Intelligence Service, who is certain that he knows the patient as a man who cooperated with the Germans. Caravaggio believes that the patient's memory is largely in tact and that he is running away from his past, in part or in its entirety. The patient does open up about his past, all surrounding his work as a cartographer in North Africa, which was interrupted by the war. He may not be running from his work as a spy for the Germans as Caravaggio believes, but rather the memory of an affair he had with married Katherine Clifton, the love of his life, and the memory of a promise not totally fulfilled. Hana may also test her theory of her fates with love and death as she embarks on a relationship of her own with Kip Singh, a Sikh from India, whose unit has camped on the now overgrown lawn of the church. Their work entails sweeping for and diffusing mines, the discovery of one such mine which had earlier saved her life. The sweeping expanses of the Sahara are the setting for a passionate love affair in this adaptation of Michael Ondaatjes novel. A badly burned man, Laszlo de Almasy, is tended to by a nurse, Hana, in an Italian monastery near the end of World War II. His past is revealed through flashbacks involving a married Englishwoman and his work mapping the African landscape. Hana learns to heal her own scars as she helps the dying man. Beginning in the 1930's, ""The English Patient"" tells the story of Count Almásy who is a Hungarian map maker employed by the Royal Geographical Society to chart the vast expanses of the Sahara Desert along with several other prominent explorers. As World War II unfolds, Almásy enters into a world of love, betrayal, and politics that is later revealed in a series of flashbacks while Almásy is on his death bed after being horribly burned in a plane crash. A burn victim, a nurse, a thief, and a sapper find themselves in each others company in an old Italian villa close to the end of World War II. Through flashbacks, we see the life of the burn victim, whose passionate love of a woman and choices he made for her ultimately change the lives of one other person in the villa. Not only is this film a search for the identity of the English patient, but a search for the identities of all the people in the quiet old villa. In a crumbling villa in WWII Italy, during the final days of the European campaign, a young, shell-shocked war nurse (Hana) remains behind to tend her doomed patient - a horribly burned pilot. Through the gradual unraveling of his life and the appearance of an old family friend (Caravaggio) and a young Sikh sapper (Kip), the question of identity is explored. The moving story of a Hungarian mapmaker and his dying memories of the romance that tragically alters his life. Burned horribly in a fiery plane crash while crossing the Sahara Desert during WWII, he is tended to by a Canadian nurse with ghosts of her own and haunted by a thief seeking answers for a crime from his past. At the close of WWII, a young nurse tends to a badly-burned plane crash victim. His past is shown in flashbacks, revealing an involvement in a fateful love affair.",patient nurse flashback english church dying german death sikh canadian burn_victim sahara thief desert spy ghost royal_geographical_society map map_maker friend count cartographer betrayal 1930s female_full_frontal_nudity foreplay character's_point_of_view_camera_shot candle reference_to_god reference_to_anna_karenina condensed_milk budapest_hungary washing_hair libya tripoli_libya suicide euthanasia colonialism reference_to_benito_mussolini reference_to_adolf_hitler defusing_a_bomb airplane sewing tea reference_to_rommel anti_aircraft wedding_anniversary cafe gun reference_to_irving_berlin german_soldier kama_sutra bridge unconsciousness shooting_up courtroom broken_rib broken_wrist broken_ankle garden curse bracelet dream partisan truck_accident french ethiopia painting war_injury hand_injury map_making campfire library bra evacuation swimming flashlight war_wound wound bicycle rain underwear undressing muslim strangulation beating cathedral tent writing watching_a_movie theatre_audience cave bath lie flash_forward egyptologist archaeologist photograph camera drink drinking bar pyramid sphinx turban crying red_cross truck bomb roadside_bomb blood wind reference_to_johann_sebastian_bach theft spin_the_bottle song singing singer abandoned_monastery fear year_1942 year_1944 cigarette_smoking paper_crown unfaithfulness tuscany_italy tragic_event shared_bath sex_scene airplane_crash loyalty capture british british_army female_nudity female_frontal_nudity bathtub tragic_love survivor star_crossed_lovers refugee melancholy disfigurement compassion burnt_flesh burnt_face sexual_tension sex_standing_up drug_overdose atheist geneva_convention machine_gun gunfire explosion escape camel burn_injury booby_trap automobile_accident adultery canadian_expatriate landmine blockbuster ve_day torture tobruk thunderstorm tank stranded statue signal_flare severed_thumb santa_claus_suit reading movie_theatre minesweeper marriage fire field_hospital egypt eavesdropping drawing doomed_love dinner_party dancing cuckold christmas cavern caravan book bomb_disposal biplane beach assisted_suicide airplane_accident 1940s train cairo_egypt revenge cave_painting art shampoo ownership sandstorm world_war_two tragedy independent_film based_on_novel memory hungarian italy explorer india pilot italian plane_crash_victim promise wife husband swing_music bedouin sand speculum eggs cooking homosexuality guide car heart plum outdoor_movie anniversary_present hedgehog bargain market old_town big_band_music ballroom_dance anniversary wadi saffron thimble pickpocket breasts subjective_camera suicide_by_gunshot palace_of_winds_india hoist pearl_necklace operating_room record_player recording mittens knife knocked_out interpreter cane orchard pianist montreal_quebec_canada injection hypodermic_needle obsession motorcycle prayer shower handcuffs suffering pain newsreel_footage photographer kiss tears jeep newlyweds nazi jumping_from_a_train irony historical_event healing friendship ex_thief nurse_patient_relationship passion obsessive_love jealousy haunted_by_the_past murder melodrama moral_ambiguity prisoner infidelity hopscotch interracial_relationship piano paratrooper nonlinear_timeline morphine monastery interrogation famous_score face_slap extramarital_affair expedition shepherd's_hotel pubic_hair female_pubic_hair bengasi_libya fiance_fiancee_relationship barn african dancer restaurant american_flag rifle fascist cross bagpipes arab nightclub severed_finger amnesia,7.4,"144,034"
115,tt5049258,My Journey: Mencari Mata Air (2016) - IMDb,1h 35min,Adventure,Joko_Nugroho,Joko_Nugroho,Btari_Chinta Christopher_V._Warren Cindy_Celine,"Four young people; Chinta, Cindy, Tasya and Celine intend to fill their holidays with friends come from New York named Lucas who are interested in the environment...
                    See full synopsis »",,9.2,11
116,tt3659162,The Closer (2015) - IMDb,1h 35min,Action Crime Drama,Eli_Hershko,Victor_Baranes Isaac_Broyn,Patrick_Duke_Conboy Brandon_deSpain Johnny_Sibilly,A tale of friendship and betrayal between 3 friends set against the backdrop of Brooklyn real estate market during the biggest boom and bust of the subprime meltdown A tale of friendship and betrayal between 3 friends set against the backdrop of Brooklyn real estate market during the biggest boom and bust of the subprime meltdown,,8.7,12
117,tt0268978,A Beautiful Mind (2001) - IMDb,2h 15min,Biography Drama,Ron_Howard,Akiva_Goldsman Sylvia_Nasar,Russell_Crowe Ed_Harris Jennifer_Connelly,"After John Nash, a brilliant but asocial mathematician, accepts secret work in cryptography, his life takes a turn for the nightmarish. From the heights of notoriety to the depths of depravity, John Forbes Nash, Jr. experienced it all. A mathematical genius, he made an astonishing discovery early in his career and stood on the brink of international acclaim. But the handsome and arrogant Nash soon found himself on a painful and harrowing journey of self-discovery. After many years of struggle, he eventually triumphed over his tragedy, and finally - late in life - received the Nobel Prize. At Princeton University, John Nash struggles to make a worthwhile contribution to serve as his legacy to the world of mathematics. He finally makes a revolutionary breakthrough that will eventually earn him the Nobel Prize. After graduate school he turns to teaching, becoming romantically involved with his student Alicia. Meanwhile the government asks his help with breaking Soviet codes, which soon gets him involved in a terrifying conspiracy plot. Nash grows more and more paranoid until a discovery that turns his entire world upside down. Now it is only with Alicia's help that he will be able to recover his mental strength and regain his status as the great mathematician we know him as today. John Nash goes through a myriad of highs and lows from his time as a Mathematics student in graduate school at Princeton in the late 1940's to his Nobel Prize win for Economics in 1994. A brilliant but somewhat arrogant and antisocial man, Nash preferred to spend his time with his thoughts, which were primarily of seeing mathematical formula associated with everyday occurrences, than with people. Two people he did make a connection with were Charles, his roommate at Princeton, and Alicia Larde, one of his students when he was teaching at M.I.T. in the early 1950's. He and Alicia eventually marry. As time goes on, Nash lives more and more within himself which causes major problems in his life. But Alicia stands by her husband to his redemption to the Nobel Prize win. Nash learns that his graduate school colleagues, with whom he had a cordial but somewhat distant relationship, are closer friends than he imagined, although in his later life he really does miss Charles' company more than anything despite knowing that spending time with Charles is not in his or anyone's best interest. After John Nash, a brilliant but asocial mathematician, accepts secret work in cryptography, his life takes a turn for the nightmarish.",mathematician conspiracy cryptography mental_illness nobel_prize school game_theory professor game_of_go spy psychiatrist paranoid_schizophrenia paranoia harvard student teaching mathematics secret university soviet princeton_university 1950s 1940s genius roommate economics kiss box_office_hit imagination three_word_title black_dress party drinking_alcohol alcohol socially_awkward taking_a_photograph posing_for_a_photograph flash_camera film_camera large_format_camera shot_in_sequence scholar bicycling medicine stars governor agent bomb blackboard laboratory standing_ovation security camera army_general map military anguish applause dancing mother_son_relationship tradition hearing_voices rage princeton_new_jersey soldier anger baby_carriage mental_institution punched_in_the_face husband_wife_relationship cambridge_massachusetts wedding_gown seal classified_information military_police reference_to_joseph_mccarthy remote_control department_of_defense reference_to_j._robert_oppenheimer washington_d.c. playing_pool reference_to_d._h._lawrence record_player reference_to_samuel_morse phonograph_record reference_to_albert_einstein audience 1980s doctor blood tears suspense reality wheelchair nurse handcuffed little_girl painting foot_chase russian pistol painter covert photographer central_intelligence_agency scientist holding_shoes_in_hand apophenia broken_mirror breaking_a_mirror epilepsy reference_to_isaac_newton techne side_effect schizophrenic niece delusion class calculus beer baby teacher father_son_relationship dating hallucination no_opening_credits schizophrenia shock_therapy prank loner ivy_league humiliation college famous_score top_secret tool_shed stockholm_sweden star_gazing speech shootout self_mutilation rooftop rivalry restaurant reception rainstorm psychiatric_hospital picnic pen necktie marriage_proposal library lecture implant imaginary_friend hypodermic_needle government_agent friendship flirting flashback face_slap cold_war car_chase boston_massachusetts bathtub 1990s 1970s 1960s wedding pool_game pentagon_building new_jersey medication massachusetts_institute_of_technology marriage guilt chase bar epiphany blockbuster code_breaking thorazine creativity insulin_coma_therapy based_on_book cult_film,8.2,"623,581"
118,tt0041610,Lust for Gold (1949) - IMDb,1h 30min,Adventure Crime Western,S._Sylvan_Simon George_Marshall,Ted_Sherdeman Richard_English,Ida_Lupino Glenn_Ford Gig_Young,"Fortune seeker Barry Storm stumbles onto some clues that may lead him to the fabulous Lost Durchman Mine, but others have tried and been murdered. The tale of how immigrant Jacob Walz, the ""Dutchman"" (German) of Arizona's notorious Lost Dutchman gold mine, found treasure and love and lost them again. Amateur treasure hunter Barry Storm becomes obsessed with finding the fabled Lost Dutchman Gold Mine and follows another adventurer, Floyd Buckley, into Arizona's desolate Superstition Mountains. Buckley claims to have a map and knows how to decipher the geologic aberrations and cryptic signs written on a large rock, all essential elements in locating the treasure trove. Unfortunately for them both, Buckley gives Storm the slip but meets the same fate that has befallen others who have gotten too close to the treasure... he is found shot to death by a phantom gunman. After being shot at by the mysterious killer himself, Storm stumbles across the rifle of German immigrant Jacob Walz, the dour ""Dutchman"" of legend, who committed multiple murders in the 1880s to become the only living soul to know the location of the treasure. In flashback, Walz brags to the townsfolk that the gold he spends so freely comes from the fabulous Peralta Mine but stubbornly refuses to disclose its location and teases them with riddles that offer enigmatic clues to its location. Walz becomes increasingly paranoid about his secret, especially when he finds out the the grasping woman he loves is already married and scheming to find his gold. Fortune seeker Barry Storm stumbles onto some clues that may lead him to the fabulous Lost Durchman Mine, but others have tried and been murdered.",dutchman lost gold immigrant gold_mine arizona murder shot_to_death mountain flashback map the_end intermittent_narration reference_to_santa_claus reference_to_satan year_1887 speaking_german hand_drawn_map overheard_conversation love_triangle unhappily_married_woman kissing_a_married_woman kiss_on_the_lips indian_attack moonlight symbol lost_mine begins_with_death begins_with_narration hidden_gold three_word_title fall_off_cliff_to_death falling_off_a_cliff fall_to_death hit_with_a_boulder stabbed_to_death stabbed_with_a_knife wife_kills_husband murder_suspect discovering_a_dead_body self_narration small_western_town rattlesnake_bite cipher passed_out_drunk doublecross deputy_sheriff barbershop baker's_shop apache_indian mickey_finn opening_action_scene sexual_mores drunkenness tramp small_town treachery campfire falling_rock attack fall_from_height spear investigation fistfight canyon canteen vulture punched_in_the_face gunfight slut face_slap cookie husband_wife_relationship hidden_treasure playing_cards buried_rifle rattlesnake isolated_place newspaper_article phoenix_arizona remote full_moon snake_bite knife thirst photo_album scam saloon_girl photograph corpse pick cactus burro interrogation massacre gold_nugget cuckold marital_infidelity earthquake shot_in_the_back stabbed_in_the_back avarice ruthlessness mysterious_killer first_person_narration german_american treasure_hunt native_american suspense melodrama wealth violence told_in_flashback swindle sheriff saloon rich prospector mule mexican lust killing jealousy greed gold_ore gold_digger duplicity drinking distrust deception coroner betrayal assayer 1940s 1870s revenge desert based_on_book,7.0,732
119,tt0331232,Dhyasparva (2001) - IMDb,2h 15min,Biography Drama History,Amol_Palekar,Chitra_Palekar,Seema_Biswas Nishith_Dadhich Mohan_Gokhale,Add a Plot »,family_planning reformer social_reform remarriage widow wedding hindu death_in_childbirth woman_in_labor midwife childbirth boy doctor gynecologist pioneer birth_control ostracism 20th_century india childless_couple man_wearing_glasses marathi radicalism fundamentalism puritanism public_humiliation based_on_true_story,8.6,29
120,tt0273799,Max Keeble's Big Move (2001) - IMDb,1h 26min,Comedy Crime Family,Tim_Hill,David_L._Watts Jonathan_Bernstein,Alex_D._Linz Larry_Miller Jamie_Kennedy,"Max Keeble, the victim of his 7th grade class, plots revenge when he learns he's moving; it backfires when he doesn't move after all. Max Keeble is a nice, quiet teenager, whose idea of 'superhero-requiring' danger is braving Evil Ice Cream Man who blames him for a health complaint from ma Lily. She spent six years on just the right interior and now hears from dad Don Keeble, a wimp whose 'career' in commercial publicity still only got him wearing sly costumes, a promotion requires the family to move to Chicago. Initially Max just hates giving up his high-school friends, a fatso and a music-maniac, but when their former friend Troy McGinty picks on them with his new image as bully realizes leaving means he can't be punished after Friday, and plans an orgy of revenge. Max's targets include the arrogant new principal, Elliot T. Jindraike, who spends the school budget on a new sports stadium to flatter the inspector, Superintendant Bobby 'Crazy Legs' Knebworth, and even plants to tear down the animal shelter. When it's all in motion, dad suddenly announces he has taken Max's first advice and turned down the promotion! Max Keeble is just an average teenager. He is the local paperboy who is often ridiculed by the Evil Ice Cream Man, and is also just starting middle school with his friends, clarinet-loving Megan, and obese kid Robe, and his crush, Jenna. They're all continuously bullied by Troy McGinty and his gang, and their school principal, Jindraike, who wants to destroy the animal shelter across the street from their school to build a football field. However, Max soon hears from his parents that his family is moving to Illinois, and Max and his friends decided to plot against his enemies within a week. Following their plan to rid the school of Jinkdraike and Troy and his gang, Max realizes he won't be moving at all. After being harassed by the school bullies and the Principal, Max Keeble learns that his family is moving away, so he spends his last week at school getting his revenge on his tormenters only to learn that he's not moving after all, and he is left at the mercy of his victims, or lack of it. Max Keeble is just a normal sixth-grader who gets harassed by the school bullies and the principal and soon finds out from his parents that he's moving away. He starts to get revenge on the people who harasses him and soon finds out later that he's not moving. Max Keeble, the victim of his 7th grade class, plots revenge when he learns he's moving; it backfires when he doesn't move after all.",school moving principal revenge bully ice_cream animal animal_shelter ice_cream_man middle_school school_principal paperboy 13_year_old thirteen_year_old drumline lifting_someone_into_the_air no_opening_credits underdog student irreverence child's_point_of_view video_camera sheep schoolboy school_kids school_janitor school_child school_administrator ostrich newspaper_headline newspaper_boy newspaper_article mother_son_relationship janitor ice_cream_truck ice_cream_cone goat dumpster chainsaw father_son_relationship public_humiliation prank bullying head_in_a_toilet children junior_high_school helium_inhalation food_fight junkyard friendship practical_joke embezzlement pre_teen dream hit_in_the_crotch chimpanzee extortion character_name_in_title,5.3,"5,872"
121,tt1686831,Wrists (2010) - IMDb,1h 18min,Drama Horror Mystery,John_Bradburn,John_Bradburn,Mish_Boyko Heather_Darcy Ellie_Dickens,"A woman moves in to an idyllic country house to recover from a traumatic event. One day she rescues a man from crashing his motorbike. She becomes obsessed with him and his slowly drawn ...
                    See full summary » A woman moves in to an idyllic country house to recover from a traumatic event. One day she rescues a man from crashing his motorbike. She becomes obsessed with him and his slowly drawn into his dark world. An experimental narrative that flows through reality, fantasy fear and imagination along different streams of consciousness.",,6.3,10
122,tt0263118,The Best of Dr. Seuss (2000) - IMDb,57min,Animation Family,,,,"This goes over the stories of Daisy-Head Mayzie, Horton Hatches the Egg!, and Butter Battle Book in animation form for children to enjoy. This goes over the stories of Daisy-Head Mayzie, Horton Hatches the Egg!, and Butter Battle Book in animation form for children to enjoy.",,7.0,26
123,tt0021491,Troopers Three (1930) - IMDb,1h 20min,Action Adventure Comedy,B._Reeves_Eason Norman_Taurog,Arthur_Guy_Empey Jack_Natteford,Rex_Lease Dorothy_Gulliver Roscoe_Karns,"Eddie Haskins, a wisecracking young man, teams up with two ham-acrobats known as 'Bugs & Sunny', and ,when they are all kicked out of a vaudeville theater in California, they enlist in the ...
                    See full summary » Eddie Haskins, a wisecracking young man, teams up with two ham-acrobats known as 'Bugs & Sunny', and ,when they are all kicked out of a vaudeville theater in California, they enlist in the U. S. Cavalry. Eddie falls in love with Dorothy Clark, the daughter of a sergeant and, following a moonlight tryst, they are discovered by Sergeant Hank Darby who himself is in love with Dorothy. They have a fist-fight in which Eddie comes out second best. When Darby is reprimanded for fighting with an enlisted man, the troopers incorrectly think that Eddie squealed on him, and they punish him with a conspiracy of silence. Dorothy also rejects him. Eddie has a problem. Maybe a fire will break out in the stables and he can rescue Sergeant Darby.",u.s._cavalry reprimand rebellion damsel_in_distress code_of_silence banana_republic army_base,5.5,6
124,tt1673509,The Mummerman (2010) - IMDb,1h 23min,Action Comedy Crime,James_Hauser,James_Hauser James_Hauser,Curt_Mummer Stephanie_Bilharz Ryan_Farrell,"Tired of being a push over, Curt Mummer creates an alter ego, that helps him stand up for himself, and others. Tired of being a push over, Curt Mummer creates an alter ego, that helps him stand up for himself, and others.",,7.9,7
125,tt4273500,The Conway Curve (2015) - IMDb,1h 30min,Comedy Crime Drama,Marian_Yeager,Richard_Dane_Scott Marian_Yeager,Veronica_Wylie Bradley_Snedeker Charlie_Bodin,"When Natalie Conway's father passes away, she believes she will forever be on her own. So when her long lost brother, Luke, returns after a twenty-year hiatus she's elated. He's a missing ...
                    See full summary » When Natalie Conway's father passes away, she believes she will forever be on her own. So when her long lost brother, Luke, returns after a twenty-year hiatus she's elated. He's a missing piece to a familial puzzle that she believed lost. There's only one problem - Luke is a notorious scam-artist, and Natalie is the sole heir to their family's small fortune. Her feelings and his motives collide as brother and sister vie to get what they desire.",,6.9,7
126,tt3033080,Extinction (2014) - IMDb,1h 43min,Adventure Thriller,Adam_Spinks,Ben_Loyd-Holmes Adam_Spinks,Sarah_Mac Ben_Loyd-Holmes Neil_Newbon,"Deep in the Amazon jungle a research team lead by a respected Professor strive to protect vulnerable and endangered species, but when their guides abandon them they soon realize they are in the hunting ground of prehistoric apex predators. Deep in the Amazon jungle a research team lead by a respected Professor strive to protect vulnerable and endangered species, but when their guides abandon them they soon realize they are in the hunting ground of prehistoric apex predators.",amazon jurassic dinosaur monster,3.3,920
